{"$schema":"https://json-schema.org/draft/2020-12/schema","$id":"https://actiongate.dev/c01/profile-independent-review-receipt-v2","type":"object","additionalProperties":false,"required":["schema","template","repository","issue","dispatch_issue","dispatch_pr","dispatch_epoch","reviewer","audited_subjects","falsifiers","findings","dissent","verdict","evidence_ceiling","human_owned"],"properties":{"schema":{"const":"actiongate-c01-independent-review-receipt/v2"},"template":{"type":"boolean"},"repository":{"const":"ed3c/ActionGate"},"issue":{"const":26},"dispatch_issue":{"const":60},"dispatch_pr":{"type":"integer","minimum":0},"dispatch_epoch":{"type":"string","pattern":"^[0-9a-f]{40}$"},"reviewer":{"type":"object","additionalProperties":false,"required":["context_id","kind","separate_context","implemented_or_repaired_audited_subjects","built_dispatch_packet","same_context_as_builder","read_only","source_mutation_performed","private_context_accessed"],"properties":{"context_id":{"type":"string","minLength":8},"kind":{"enum":["EXTERNAL_CODEX_REPLAY","EXTERNAL_HUMAN_REVIEWER","OTHER_SEPARATE_READ_ONLY_SESSION"]},"separate_context":{"type":"boolean"},"implemented_or_repaired_audited_subjects":{"type":"boolean"},"built_dispatch_packet":{"type":"boolean"},"same_context_as_builder":{"type":"boolean"},"read_only":{"type":"boolean"},"source_mutation_performed":{"type":"boolean"},"private_context_accessed":{"type":"boolean"}}},"audited_subjects":{"type":"object"},"falsifiers":{"type":"array","minItems":33,"maxItems":33,"items":{"type":"object","additionalProperties":false,"required":["id","state","evidence"],"properties":{"id":{"type":"string"},"state":{"enum":["PASS","FAIL","NOT_EXERCISED"]},"evidence":{"type":"string","minLength":1}}}},"findings":{"type":"array","items":{"type":"object"}},"dissent":{"type":"array","items":{"type":"string"}},"verdict":{"enum":["ELIGIBLE_FOR_C01_CONVERGENCE","HOLD","REJECT"]},"evidence_ceiling":{"const":"independent read-only C01 contract and language review only"},"human_owned":{"type":"array","contains":{"const":"merge"}}},"allOf":[{"if":{"properties":{"template":{"const":true}}},"then":{"properties":{"dispatch_pr":{"const":61},"verdict":{"const":"HOLD"},"falsifiers":{"items":{"properties":{"state":{"const":"NOT_EXERCISED"}}}}}}},{"if":{"properties":{"template":{"const":false},"verdict":{"const":"ELIGIBLE_FOR_C01_CONVERGENCE"}}},"then":{"properties":{"falsifiers":{"items":{"properties":{"state":{"const":"PASS"}}}}}}}]}
