{"schema":"actiongate-c01-independent-review-receipt/v2","template":true,"repository":"ed3c/ActionGate","issue":26,"dispatch_issue":60,"dispatch_pr":61,"dispatch_epoch":"3c45fd792fccc704fb4dff84faf4fc51de032f82","reviewer":{"context_id":"UNSET000","kind":"OTHER_SEPARATE_READ_ONLY_SESSION","separate_context":false,"implemented_or_repaired_audited_subjects":false,"built_dispatch_packet":false,"same_context_as_builder":false,"read_only":true,"source_mutation_performed":false,"private_context_accessed":false},"audited_subjects":{"contract_epoch":"b63589e5a16e82fda1a9554227f2ebbb55398c8a","common_evidence":"9f41038240837ea2dd9dcdb9befd13e6ba81a78e","kotlin":{"current_head":"cf589a0990aaaa6422be9c649b52b44230d570f6","current_tree":"10a35f943aaee0b0035132100357a1adbacff7e1","source_candidate":"0247eb1fc7201b51aded66f2c2311aa42f9ca83c","source_tree":"15a27f2d9dbaacdfbea57dc1cd37e4af284b09dc","receipt_subject":"9420a4cdb4c7119ff56d921688a65d62ff92cf39","receipt_tree":"c4d5b2fcd70b29b993d149e7120d149c82272592","receipt_blob":"73e38ebfadf4512d1fbff63ba3d6b428ee5c46a7","shadow_blob":"0dec1c52b2e197c24deac9d0ac2ab9c2e69c78a2"},"swift":{"current_head":"039827061f54aa72e2b81365a4c904d25833f83e","current_tree":"015cc3123b3b09ea0c087028aaea2ee052c51508","source_candidate":"2f089d45056fd783f57f3458dc739f33a49304c7","source_tree":"684275693783c379b134bd499a7dcddeb1f0b34c","receipt_subject":"acd6ef93dc2f17340c86d5e45fa7a56496a53d52","receipt_tree":"921a8fd1d7584991c0321bd3dadf6959b24a480c","receipt_blob":"31384670f22a0ff9558a0257ec6bb916056d1942","shadow_blob":"4345e5354d49338613b5e71419dc639a7803b89a"},"typescript":{"current_head":"3ed9f0307df0937028bbf52fe8fbd2a6621acafe","current_tree":"17532a35f42b07e350e7785a7be11038c9cf1ba0","source_candidate":"dbdcfdcd8f100c3135730bc828700ffc8239994e","source_tree":"39a40aab9f13fdcae04d3164669667aa7322029c","receipt_subject":"9f4f19468fda8c32cab376484ed75855bb577277","receipt_tree":"75e8d5fd360a2f15af6a27b62aa02b765b7392a1","receipt_blob":"4b16df1f702cc4e91dcef8c873cdf8df67cdd2b6","shadow_blob":"d398b39159e8aa4b1347315911330136c95b1504"}},"falsifiers":[{"id":"three_frozen_hashes","state":"NOT_EXERCISED","evidence":"Reviewer must replace with exact public-safe evidence."},{"id":"ordering","state":"NOT_EXERCISED","evidence":"Reviewer must replace with exact public-safe evidence."},{"id":"float_rejected","state":"NOT_EXERCISED","evidence":"Reviewer must replace with exact public-safe evidence."},{"id":"unsafe_integer_rejected","state":"NOT_EXERCISED","evidence":"Reviewer must replace with exact public-safe evidence."},{"id":"invalid_key_rejected","state":"NOT_EXERCISED","evidence":"Reviewer must replace with exact public-safe evidence."},{"id":"unsupported_value_rejected","state":"NOT_EXERCISED","evidence":"Reviewer must replace with exact public-safe evidence."},{"id":"duplicate_key_control","state":"NOT_EXERCISED","evidence":"Reviewer must replace with exact public-safe evidence."},{"id":"unicode_no_normalization","state":"NOT_EXERCISED","evidence":"Reviewer must replace with exact public-safe evidence."},{"id":"accessor_rejection","state":"NOT_EXERCISED","evidence":"Reviewer must replace with exact public-safe evidence."},{"id":"escaped_native_duplicate_equivalence","state":"NOT_EXERCISED","evidence":"Reviewer must replace with exact public-safe evidence."},{"id":"exact_ascii_domain_trailing_nul","state":"NOT_EXERCISED","evidence":"Reviewer must replace with exact public-safe evidence."},{"id":"extra_array_property_rejection","state":"NOT_EXERCISED","evidence":"Reviewer must replace with exact public-safe evidence."},{"id":"leading_zero_rejection","state":"NOT_EXERCISED","evidence":"Reviewer must replace with exact public-safe evidence."},{"id":"lone_surrogate_rejection","state":"NOT_EXERCISED","evidence":"Reviewer must replace with exact public-safe evidence."},{"id":"missing_nul_rejected","state":"NOT_EXERCISED","evidence":"Reviewer must replace with exact public-safe evidence."},{"id":"mutable_foundation_container_rejection","state":"NOT_EXERCISED","evidence":"Reviewer must replace with exact public-safe evidence."},{"id":"non_ascii_domain_rejected","state":"NOT_EXERCISED","evidence":"Reviewer must replace with exact public-safe evidence."},{"id":"recursive_container_rejection","state":"NOT_EXERCISED","evidence":"Reviewer must replace with exact public-safe evidence."},{"id":"sha256_known_answer_vectors","state":"NOT_EXERCISED","evidence":"Reviewer must replace with exact public-safe evidence."},{"id":"sparse_array_rejection","state":"NOT_EXERCISED","evidence":"Reviewer must replace with exact public-safe evidence."},{"id":"surrogate_pair_acceptance","state":"NOT_EXERCISED","evidence":"Reviewer must replace with exact public-safe evidence."},{"id":"symbol_key_rejection","state":"NOT_EXERCISED","evidence":"Reviewer must replace with exact public-safe evidence."},{"id":"unsupported_prototype_rejection","state":"NOT_EXERCISED","evidence":"Reviewer must replace with exact public-safe evidence."},{"id":"registered_domain_allowlist","state":"NOT_EXERCISED","evidence":"Reviewer must replace with exact public-safe evidence."},{"id":"unknown_domain_rejected","state":"NOT_EXERCISED","evidence":"Reviewer must replace with exact public-safe evidence."},{"id":"embedded_nul_domain_rejected","state":"NOT_EXERCISED","evidence":"Reviewer must replace with exact public-safe evidence."},{"id":"raw_ascii_key_profile","state":"NOT_EXERCISED","evidence":"Reviewer must replace with exact public-safe evidence."},{"id":"raw_fraction_rejected","state":"NOT_EXERCISED","evidence":"Reviewer must replace with exact public-safe evidence."},{"id":"raw_exponent_rejected","state":"NOT_EXERCISED","evidence":"Reviewer must replace with exact public-safe evidence."},{"id":"raw_positive_unsafe_integer_rejected","state":"NOT_EXERCISED","evidence":"Reviewer must replace with exact public-safe evidence."},{"id":"raw_negative_unsafe_integer_rejected","state":"NOT_EXERCISED","evidence":"Reviewer must replace with exact public-safe evidence."},{"id":"raw_safe_integer_boundaries","state":"NOT_EXERCISED","evidence":"Reviewer must replace with exact public-safe evidence."},{"id":"raw_negative_zero_accepted","state":"NOT_EXERCISED","evidence":"Reviewer must replace with exact public-safe evidence."}],"findings":[],"dissent":["Template only. Independent review has not run."],"verdict":"HOLD","evidence_ceiling":"independent read-only C01 contract and language review only","human_owned":["semantic conflict resolution","security/legal acceptance","merge","release","production"]}
